{
  "$schema": "https://json-schema.org/draft/2020-12/schema",
  "additionalProperties": false,
  "properties": {
    "expected_information_gain": {
      "type": "number"
    },
    "feedback_id": {
      "type": "string"
    },
    "ikros_update": {
      "type": "string"
    },
    "mechanism": {
      "type": "string"
    },
    "recommended_action": {
      "type": "string"
    },
    "timestamp": {
      "type": "string"
    },
    "trigger": {
      "type": "string"
    }
  },
  "required": [
    "feedback_id",
    "timestamp",
    "trigger",
    "recommended_action",
    "expected_information_gain"
  ],
  "title": "Research Feedback Entry",
  "type": "object"
}